{
  "$schema": "http://json-schema.org/draft-07/schema#",
  "$id": "urn:lhsmachinecenter:manifest:v1",
  "title": "Machine Manifest v1",
  "description": "Per-machine manifest schema per 04_architecture_proposal_v5.md §5.5.2. Covers all v5 fields. Phase 3 may extend for new fields discovered during 421-manifest authoring.",

  "type": "object",
  "required": ["machine_id", "manifest_version"],

  "properties": {

    "machine_id": {
      "type": "string",
      "minLength": 1,
      "description": "Machine identifier, e.g. 'M274' or 'M273$WheelSelector$42$' for variants. Unique across the fleet."
    },

    "manifest_version": {
      "type": "integer",
      "minimum": 1,
      "description": "Schema version number. Currently 1. Bump when the manifest schema breaks backward compatibility."
    },

    "inherits_from": {
      "oneOf": [
        {"type": "null"},
        {"type": "string", "minLength": 1, "pattern": "\\.json$"}
      ],
      "description": "Filename of the parent manifest (e.g. 'M273.json') for variant machines. Null for non-variant (underlying) machines. Per §5.5.4-5.5.5."
    },

    "console_diagnostic_complete": {
      "type": "boolean",
      "description": "Non-variant machines only. True = operator declares console can diagnose correctly; hard errors on integrity failure. False = development mode; warnings only. Per §5.5.3."
    },

    "console_diagnostic_complete_override": {
      "type": "boolean",
      "enum": [false],
      "description": "Variant manifests only. Must be false (never true — variants cannot elevate completeness above underlying). Per §5.5.7 rule 6 and rule 10. When set, override_set_at + override_set_reason + override_set_by are required."
    },

    "override_set_at": {
      "type": "string",
      "format": "date-time",
      "description": "ISO-8601 timestamp when console_diagnostic_complete_override: false was first applied. Required if console_diagnostic_complete_override: false is set. Per §5.5.7 v5 addition."
    },

    "override_set_reason": {
      "type": "string",
      "minLength": 1,
      "description": "Free-form text describing the specific edge case that triggered the override. Must reference the Layer(s) that fail on this variant's rawdata. Per §5.5.7 v5 addition."
    },

    "override_set_by": {
      "type": "string",
      "minLength": 1,
      "description": "Person/team/process responsible for the override decision (e.g. 'arch-team / 2026-05-17 arch review'). Per §5.5.7 v5 addition."
    },

    "layer4_applicable": {
      "type": "boolean",
      "description": "Whether rtp_integrity.py Step B (Layer 4 trigger-session re-attribution check) is applicable for this machine. False when trigger_session_pattern is non-null at machine level. Validated by rule 11: non-null trigger_session_pattern + layer4_applicable: true is an error. Per §5.5.2 v5 addition and §9.4."
    },

    "spin_type_convention": {
      "type": "object",
      "required": ["paid", "bonus"],
      "properties": {
        "paid": {
          "type": "array",
          "items": {"type": "integer"},
          "description": "List of spin type integers that are paid rounds for this machine."
        },
        "bonus": {
          "type": "array",
          "items": {"type": "integer"},
          "description": "List of spin type integers that are bonus rounds for this machine. May be empty."
        }
      },
      "additionalProperties": false,
      "description": "Spin type convention for this machine. Overridable per-mode via spin_type_convention_override. Per §5.5.6."
    },

    "feature_tags": {
      "type": "array",
      "items": {"type": "string", "minLength": 1},
      "description": "Human-readable tags describing this machine's feature cluster (e.g. ['BCM', 'Wheel']). Overridable per-mode. Per §5.5.2."
    },

    "round_win_rules": {
      "type": "array",
      "items": {"type": "string", "minLength": 1},
      "description": "List of round_win_rule IDs applicable to this machine. IDs must exist in machine_round_win_rules.json with this machine in applies_to. Per §5.5.2 and §5.9."
    },

    "analyzer_features": {
      "type": "array",
      "items": {"type": "string", "minLength": 1},
      "description": "FEATURE_ID strings declaring which AnalyzerFeature plugins apply to this machine. Must match feature_registry.ALL_FEATURES entries. Per §5.5.2 and §5.5.4."
    },

    "bcm_target_feature": {
      "type": "string",
      "minLength": 1,
      "description": "Name of the BCM target feature for BCM-class machines (e.g. 'ListRewardWheel', 'Wheel', 'MoveSpin'). Overridable per-mode via bcm_target_feature_override. Per §5.5.6."
    },

    "selector_type": {
      "type": "string",
      "minLength": 1,
      "description": "Selector class name for selector-type machines (e.g. 'TopDollarSelector'). Informational; used by variants fleet routing. Per §5.11 M15 example."
    },

    "trigger_session_pattern": {
      "oneOf": [
        {"type": "null"},
        {"type": "string", "enum": ["type_1", "type_2"]}
      ],
      "description": "Trigger-session re-attribution pattern. Null = no trigger sessions (Layer 4 applicable). 'type_1' or 'type_2' = trigger sessions present (sets layer4_applicable: false per rule 11). Overridable per-mode via trigger_session_pattern_override. Per §5.5.6 and §9.4."
    },

    "modes_supported": {
      "type": "array",
      "items": {"type": "integer", "minimum": 1},
      "minItems": 1,
      "description": "List of mode integers this machine supports (e.g. [1, 2, 5, 7]). Per §5.5.2."
    },

    "per_mode_overrides": {
      "type": "object",
      "description": "Per-mode override blocks keyed by string mode number ('1', '2', '5', '7', etc.). Each block applies resolution per §5.5.6: _remove then _add for list fields; _override for scalar fields. Fields machine_id, manifest_version, inherits_from, console_diagnostic_complete, layer4_applicable cannot be overridden here (§5.5.6 line 472).",
      "additionalProperties": {
        "$ref": "#/definitions/per_mode_override_block"
      }
    },

    "rtp_integrity_contract": {
      "$ref": "#/definitions/rtp_integrity_contract",
      "description": "RTP integrity contract for this machine. Per §5.5.2."
    }
  },

  "additionalProperties": false,

  "if": {
    "properties": {"inherits_from": {"type": "null"}},
    "required": ["inherits_from"]
  },
  "then": {
    "required": [
      "console_diagnostic_complete",
      "layer4_applicable",
      "spin_type_convention",
      "feature_tags",
      "round_win_rules",
      "analyzer_features",
      "trigger_session_pattern",
      "modes_supported",
      "rtp_integrity_contract"
    ]
  },

  "definitions": {

    "per_mode_override_block": {
      "type": "object",
      "description": "Override block for a single mode. Applies _remove then _add per §5.5.6 line 474.",
      "properties": {
        "analyzer_features_add": {
          "type": "array",
          "items": {"type": "string", "minLength": 1},
          "description": "FEATURE_IDs to append to the base analyzer_features list for this mode."
        },
        "analyzer_features_remove": {
          "type": "array",
          "items": {"type": "string", "minLength": 1},
          "description": "FEATURE_IDs to remove from the base analyzer_features list for this mode."
        },
        "round_win_rules_add": {
          "type": "array",
          "items": {"type": "string", "minLength": 1},
          "description": "Rule IDs to append to round_win_rules for this mode."
        },
        "round_win_rules_remove": {
          "type": "array",
          "items": {"type": "string", "minLength": 1},
          "description": "Rule IDs to remove from round_win_rules for this mode."
        },
        "bcm_target_feature_override": {
          "type": "string",
          "minLength": 1,
          "description": "Replacement bcm_target_feature for this mode (e.g. 'MoveSpin')."
        },
        "trigger_session_pattern_override": {
          "oneOf": [
            {"type": "null"},
            {"type": "string", "enum": ["type_1", "type_2"]}
          ],
          "description": "Replacement trigger_session_pattern for this mode. Per §5.5.6 and P1."
        },
        "spin_type_convention_override": {
          "type": "object",
          "required": ["paid", "bonus"],
          "properties": {
            "paid": {"type": "array", "items": {"type": "integer"}},
            "bonus": {"type": "array", "items": {"type": "integer"}}
          },
          "additionalProperties": false,
          "description": "Replacement spin_type_convention for this mode."
        },
        "feature_tags_override": {
          "type": "array",
          "items": {"type": "string", "minLength": 1},
          "description": "Replacement feature_tags list for this mode (replaces entirely, not merged)."
        },
        "required_attribution_anchors_override": {
          "type": "array",
          "items": {"type": "string"},
          "description": "Replacement required_attribution_anchors for this mode."
        },
        "expected_paid_st_override": {
          "type": "array",
          "items": {"type": "integer"},
          "description": "Replacement expected_paid_st for this mode."
        },
        "expected_bonus_st_override": {
          "type": "array",
          "items": {"type": "integer"},
          "description": "Replacement expected_bonus_st for this mode."
        }
      },
      "additionalProperties": false
    },

    "rtp_integrity_contract": {
      "type": "object",
      "required": ["expected_paid_st", "expected_bonus_st", "required_attribution_anchors"],
      "properties": {
        "expected_paid_st": {
          "type": "array",
          "items": {"type": "integer"},
          "minItems": 1,
          "description": "Expected paid spin type integers (must be non-empty per rule 7)."
        },
        "expected_bonus_st": {
          "type": "array",
          "items": {"type": "integer"},
          "description": "Expected bonus spin type integers (may be empty list for machines with no bonus STs)."
        },
        "required_attribution_anchors": {
          "type": "array",
          "items": {"type": "string"},
          "description": "Pay-ID prefixes/strings required for RTP attribution coverage. Validated at first run against rawdata (not at commit time per rule 7). May be empty for plain machines."
        }
      },
      "additionalProperties": false
    }

  }
}
